{
  "version": "1.0.0",
  "lastUpdated": "2026-08-31",
  "assessmentId": "career-finder",
  "assessmentVersion": "1.0.0",
  "defaultLanguage": "en",
  "supportedLanguages": [
    "en",
    "bn"
  ],
  "schema": "../schemas/assessment-question.schema.json",
  "description": "Canonical question catalogue for the GovCareer Compass Career Finder. Questions collect candidate facts, qualifications, skills, location preferences, career interests, family considerations and personal preferences. They do not directly determine eligibility or recommendations.",
  "designPrinciples": [
    "Eligibility facts are collected separately from personal preferences.",
    "Government-job eligibility is never hard-coded into an assessment answer.",
    "Qualification questions reference reusable qualification identifiers.",
    "State selection references the common state registry.",
    "Preference questions create normalized candidate-preference values.",
    "Branching determines which questions are presented.",
    "The eligibility engine remains authoritative for job and examination eligibility.",
    "The recommendation engine remains authoritative for suitability scoring.",
    "Sensitive family-context questions are optional in practical use even when the assessment flow may present them.",
    "The final result must explain that official recruitment notifications control final eligibility."
  ],
  "questionOrder": [
    "welcome_goal",
    "highest_education",
    "academic_qualification_type",
    "graduation_subject",
    "graduation_specialisation",
    "additional_qualification_presence",
    "additional_qualification_categories",
    "teacher_qualification",
    "technical_qualification",
    "iti_trade",
    "computer_qualification",
    "law_qualification",
    "medical_qualification",
    "nursing_qualification",
    "pharmacy_qualification",
    "engineering_qualification",
    "professional_registration",
    "driving_licence",
    "typing_skill",
    "shorthand_skill",
    "computer_skill",
    "work_experience",
    "experience_details",
    "language_bengali",
    "language_hindi",
    "language_english",
    "state_preference",
    "government_preference",
    "career_interest",
    "work_style",
    "salary_importance",
    "authority_importance",
    "prestige_importance",
    "family_importance",
    "parent_care_importance",
    "location_importance",
    "job_security_importance",
    "work_life_importance",
    "career_growth_importance",
    "housing_importance",
    "low_stress_importance",
    "low_physical_risk_importance",
    "low_transfer_importance",
    "low_night_duty_importance",
    "low_shift_duty_importance",
    "low_holiday_duty_importance",
    "low_emergency_duty_importance",
    "night_duty_tolerance",
    "physical_risk_tolerance",
    "transfer_tolerance",
    "public_dealing_preference",
    "office_field_preference",
    "competitive_exam_tolerance",
    "family_context",
    "elderly_parent_responsibility",
    "children_responsibility",
    "income_responsibility",
    "future_location_flexibility",
    "assessment_confirmation"
  ],
  "questions": [
    {
      "id": "welcome_goal",
      "type": "SINGLE_SELECT",
      "question": {
        "en": "What is your main purpose for using GovCareer Compass?",
        "bn": "GovCareer Compass ব্যবহারের আপনার প্রধান উদ্দেশ্য কী?"
      },
      "helpText": {
        "en": "Choose the type of guidance you want from the Career Finder.",
        "bn": "Career Finder থেকে আপনি কী ধরনের নির্দেশনা চান তা নির্বাচন করুন।"
      },
      "profileField": "assessment.goal",
      "required": true,
      "optionSetId": "assessment_goal",
      "sensitive": false,
      "status": "ACTIVE"
    },
    {
      "id": "highest_education",
      "type": "SINGLE_SELECT",
      "question": {
        "en": "What is your highest completed or currently pursuing educational level?",
        "bn": "আপনার সর্বোচ্চ সম্পন্ন বা বর্তমানে অধ্যয়নরত শিক্ষাগত স্তর কোনটি?"
      },
      "helpText": {
        "en": "This is your main education level. Additional qualifications are collected separately.",
        "bn": "এটি আপনার মূল শিক্ষাগত স্তর। অতিরিক্ত যোগ্যতা আলাদাভাবে সংগ্রহ করা হবে।"
      },
      "profileField": "educationLevel",
      "required": true,
      "optionSetId": "education_level",
      "sensitive": false,
      "status": "ACTIVE"
    },
    {
      "id": "academic_qualification_type",
      "type": "SINGLE_SELECT",
      "question": {
        "en": "What is your main academic qualification?",
        "bn": "আপনার প্রধান শিক্ষাগত যোগ্যতা কোনটি?"
      },
      "helpText": {
        "en": "Choose the main academic qualification relevant to your profile.",
        "bn": "আপনার প্রোফাইলের জন্য প্রাসঙ্গিক প্রধান শিক্ষাগত যোগ্যতা নির্বাচন করুন।"
      },
      "profileField": "primaryAcademicQualification",
      "required": true,
      "optionSetId": "academic_qualification_type",
      "sensitive": false,
      "status": "ACTIVE"
    },
    {
      "id": "graduation_subject",
      "type": "MULTI_SELECT",
      "question": {
        "en": "Which subject or subjects did you study in your graduation?",
        "bn": "স্নাতক স্তরে আপনি কোন বিষয় বা বিষয়গুলি পড়েছেন?"
      },
      "helpText": {
        "en": "Subject-specific recruitment can depend on the exact subject studied.",
        "bn": "বিষয়-নির্দিষ্ট নিয়োগে আপনি ঠিক কোন বিষয় পড়েছেন তা গুরুত্বপূর্ণ হতে পারে।"
      },
      "profileField": "academicSubjects",
      "required": false,
      "optionSetId": "academic_subjects",
      "sensitive": false,
      "status": "ACTIVE"
    },
    {
      "id": "graduation_specialisation",
      "type": "TEXT",
      "question": {
        "en": "Enter your exact graduation, major or honours subject.",
        "bn": "আপনার স্নাতক, মেজর বা অনার্সের নির্দিষ্ট বিষয় লিখুন।"
      },
      "helpText": {
        "en": "Use the official or commonly recognised subject name where possible.",
        "bn": "সম্ভব হলে সরকারি নথিতে ব্যবহৃত বা প্রচলিত বিষয়ের নাম লিখুন।"
      },
      "profileField": "graduationSpecialisation",
      "required": false,
      "sensitive": false,
      "status": "ACTIVE"
    },
    {
      "id": "additional_qualification_presence",
      "type": "SINGLE_SELECT",
      "question": {
        "en": "Do you have any additional professional, technical or specialist qualification?",
        "bn": "আপনার কি কোনও অতিরিক্ত পেশাগত, কারিগরি বা বিশেষায়িত যোগ্যতা আছে?"
      },
      "profileField": "hasAdditionalQualifications",
      "required": true,
      "optionSetId": "yes_no_prefer_not",
      "sensitive": false,
      "status": "ACTIVE"
    },
    {
      "id": "additional_qualification_categories",
      "type": "MULTI_SELECT",
      "question": {
        "en": "Which additional qualification categories do you have?",
        "bn": "আপনার কোন কোন অতিরিক্ত যোগ্যতার শ্রেণি রয়েছে?"
      },
      "helpText": {
        "en": "Select all relevant categories. The next questions will ask for specific qualifications.",
        "bn": "প্রাসঙ্গিক সব বিভাগ নির্বাচন করুন। পরের প্রশ্নে নির্দিষ্ট যোগ্যতা জানতে চাওয়া হবে।"
      },
      "profileField": "additionalQualificationCategories",
      "required": false,
      "optionSetId": "additional_qualification_categories",
      "sensitive": false,
      "status": "ACTIVE"
    },
    {
      "id": "teacher_qualification",
      "type": "MULTI_SELECT",
      "question": {
        "en": "Which teacher-education qualifications do you hold?",
        "bn": "আপনার কোন কোন শিক্ষক-প্রশিক্ষণ যোগ্যতা রয়েছে?"
      },
      "helpText": {
        "en": "Include only qualifications that are completed or formally being pursued.",
        "bn": "শুধুমাত্র সম্পন্ন বা আনুষ্ঠানিকভাবে অধ্যয়নরত যোগ্যতা নির্বাচন করুন।"
      },
      "profileField": "qualifications.teacherEducation",
      "required": false,
      "optionSetId": "teacher_education_qualifications",
      "sensitive": false,
      "status": "ACTIVE"
    },
    {
      "id": "technical_qualification",
      "type": "MULTI_SELECT",
      "question": {
        "en": "Which technical qualifications do you hold?",
        "bn": "আপনার কোন কোন কারিগরি যোগ্যতা রয়েছে?"
      },
      "profileField": "qualifications.technical",
      "required": false,
      "optionSetId": "technical_qualifications",
      "sensitive": false,
      "status": "ACTIVE"
    },
    {
      "id": "iti_trade",
      "type": "MULTI_SELECT",
      "question": {
        "en": "Which Industrial Training Institute (ITI) trade or trades do you hold?",
        "bn": "আপনার কোন কোন ইন্ডাস্ট্রিয়াল ট্রেনিং ইনস্টিটিউট (ITI) ট্রেড রয়েছে?"
      },
      "helpText": {
        "en": "Technical eligibility may depend on the exact trade rather than ITI alone.",
        "bn": "কারিগরি যোগ্যতা অনেক সময় শুধুমাত্র ITI নয়, নির্দিষ্ট ট্রেডের উপরও নির্ভর করে।"
      },
      "profileField": "qualifications.itiTrades",
      "required": false,
      "optionSetId": "iti_trades",
      "sensitive": false,
      "status": "ACTIVE"
    },
    {
      "id": "computer_qualification",
      "type": "MULTI_SELECT",
      "question": {
        "en": "Which computer or information-technology qualifications do you hold?",
        "bn": "আপনার কোন কোন কম্পিউটার বা তথ্যপ্রযুক্তি যোগ্যতা রয়েছে?"
      },
      "profileField": "qualifications.computer",
      "required": false,
      "optionSetId": "computer_qualifications",
      "sensitive": false,
      "status": "ACTIVE"
    },
    {
      "id": "law_qualification",
      "type": "MULTI_SELECT",
      "question": {
        "en": "Which law qualifications do you hold?",
        "bn": "আপনার কোন কোন আইন-সংক্রান্ত যোগ্যতা রয়েছে?"
      },
      "profileField": "qualifications.law",
      "required": false,
      "optionSetId": "law_qualifications",
      "sensitive": false,
      "status": "ACTIVE"
    },
    {
      "id": "medical_qualification",
      "type": "MULTI_SELECT",
      "question": {
        "en": "Which medical qualifications do you hold?",